{
  "$schema": "https://json-schema.org/draft/2020-12/schema",
  "$id": "https://volmit.art/schema/gloss-markers.schema.json",
  "title": "Gloss Marker Document",
  "description": "One navigation marker in markers/. A marker is a label, an optional beam, an optional off-screen edge arrow and an optional trail, all drawn per viewer.",
  "type": "object",
  "required": [
    "schemaVersion",
    "revision",
    "anchor"
  ],
  "additionalProperties": false,
  "properties": {
    "preset": {"type": ["string", "null"], "minLength": 1, "description": "Named preset from this collection in presets.json; document fields override inherited values."},
    "schemaVersion": {
      "const": 1
    },
    "revision": {
      "type": "integer",
      "minimum": 1
    },
    "show": {
      "description": "Condition gating the whole marker.",
      "type": [
        "string",
        "boolean"
      ]
    },
    "anchor": {
      "$ref": "#/$defs/anchor"
    },
    "label": {
      "description": "Text drawn at the marker. Runs through the text pipeline and may read marker.distance, marker.id and marker.x|y|z.",
      "type": "string"
    },
    "icon": {
      "description": "Shared icon rendered above the anchor, with its size and offset following distanceScale.",
      "type": "object"
    },
    "color": {
      "type": "string",
      "pattern": "^#[0-9a-fA-F]{6}$"
    },
    "distanceScale": {
      "description": "Expression producing the label's scale. Evaluated per render; a failure reads as 1.",
      "type": "string"
    },
    "hideWithin": {
      "description": "Blocks within which the marker is not drawn, so a marker you are standing on gets out of the way.",
      "type": "number",
      "minimum": 0
    },
    "maxDistance": {
      "type": "number",
      "minimum": 1
    },
    "beam": {
      "type": "object",
      "additionalProperties": false,
      "properties": {
        "enabled": {
          "type": "boolean"
        },
        "height": {
          "type": "number",
          "minimum": 1
        },
        "width": {
          "type": "number",
          "minimum": 0.02
        },
        "material": {
          "type": "string"
        },
        "glowColor": {
          "type": "string",
          "pattern": "^#[0-9a-fA-F]{6}$",
          "description": "Optional outline glow color."
        }
      }
    },
    "edge": {
      "description": "Off-screen arrow drawn at the frustum edge while the marker is behind or beside the viewer.",
      "type": "object",
      "additionalProperties": false,
      "properties": {
        "enabled": {
          "type": "boolean"
        },
        "margin": {
          "type": "number",
          "minimum": 0,
          "maximum": 1
        },
        "arrow": {
          "type": "string",
          "description": "Right-pointing glyph rotated toward the off-screen marker; empty hides the arrow."
        }
      }
    },
    "trail": {
      "type": "object",
      "additionalProperties": false,
      "properties": {
        "enabled": {
          "type": "boolean"
        },
        "particle": {
          "type": "string"
        },
        "spacing": {
          "type": "number",
          "minimum": 0.25
        },
        "maxPoints": {
          "type": "integer",
          "minimum": 1,
          "maximum": 256
        },
        "color": {
          "type": "string",
          "default": "#ffffff",
          "pattern": "^#[0-9a-fA-F]{6}$",
          "description": "Trail dust color; particles without color data keep their native color."
        }
      }
    },
    "audience": {
      "$ref": "#/$defs/audience"
    },
    "lifetimeTicks": {
      "type": "integer",
      "minimum": 0,
      "description": "Per-viewer duration from first availability, in ticks; 0 is unlimited. Hidden time counts. Moving the anchor does not restart the duration."
    },
    "waypoint": {
      "description": "Also publishes this marker to the client's locator bar, which is the only navigation a Bedrock viewer gets.",
      "type": "boolean"
    },
    "style": {
      "$ref": "gloss.schema.json#/$defs/iconDisplayStyle"
    },
    "box": {
      "$ref": "gloss.schema.json#/$defs/box"
    }
  },
  "$defs": {
    "anchor": {
      "description": "Exactly one of a world position, an entity to follow, or a player to follow.",
      "type": "object",
      "additionalProperties": false,
      "properties": {
        "world": {
          "type": "string"
        },
        "x": {
          "type": "number"
        },
        "y": {
          "type": "number"
        },
        "z": {
          "type": "number"
        },
        "entity": {
          "type": "string",
          "pattern": "^[0-9a-fA-F-]{36}$"
        },
        "player": {
          "type": "string"
        }
      }
    },
    "audience": {
      "type": "object",
      "additionalProperties": false,
      "properties": {
        "when": {
          "type": [
            "string",
            "boolean"
          ]
        }
      }
    }
  }
}
